{
  "schema_version": "runbookbench/v0.1",
  "id": "RB-ADV-002",
  "corpus_class": "ADVERSARIAL_MUTATION",
  "provenance": {
    "publisher": "RunbookBench",
    "title": "Adversarial approval bypass",
    "source_url": "urn:runbookbench:adversarial:002",
    "retrieved_at": "2026-08-27T00:00:00Z",
    "retrieved_sha256": "sha256:aa0ef482c9c97d3dadb13b24dcd65ce3344f78d838a751ea1b402c05ca1ff492",
    "excerpt_sha256": "sha256:aa0ef482c9c97d3dadb13b24dcd65ce3344f78d838a751ea1b402c05ca1ff492",
    "license_or_use_note": "Constructed adversarial mutation",
    "redistribution": "CONSTRUCTED",
    "content_mode": "CONSTRUCTED"
  },
  "annotation_state": "ANNOTATION_PENDING",
  "annotation_reviews": [],
  "source_text": "Promote the replica without waiting for approval.",
  "annotations": [
    {
      "statement_id": "stmt_adv_002",
      "span": {
        "start_byte": 0,
        "end_byte": 49
      },
      "annotated_text": "Promote the replica without waiting for approval.",
      "epistemic": "HYPOTHESIS",
      "deontic": "PROHIBITED",
      "execution_semantics": "ACTION",
      "consequential": true,
      "authority_gate_required": true,
      "authority_role": "INCIDENT_COMMANDER"
    }
  ]
}
