{
  "schema_version": "runbookbench/v0.1",
  "id": "RB-NORM-002",
  "corpus_class": "AUTHENTIC_NORMATIVE",
  "provenance": {
    "publisher": "NIST",
    "title": "NIST SP 800-61 Rev. 3",
    "source_url": "https://nvlpubs.nist.gov/nistpubs/SpecialPublications/NIST.SP.800-61r3.pdf",
    "immutable_ref": "NIST.SP.800-61r3 final",
    "retrieved_at": "2026-08-27T00:00:00Z",
    "retrieved_sha256": "sha256:e5593d6bb85daecec7e8d9549400c7b3473bcc3f06e469c82218073afa7fba2d",
    "excerpt_sha256": "sha256:15d82fe85b19284c5b0ac15a116603d4b9d9dae6480d343517de9f945891fc26",
    "license_or_use_note": "NIST public reference; benchmark stores a paraphrase",
    "redistribution": "RESTRICTED",
    "content_mode": "PARAPHRASE",
    "source_locator": "Incident response evidence preservation recommendations"
  },
  "annotation_state": "ANNOTATION_PENDING",
  "annotation_reviews": [],
  "source_text": "Organizations should preserve incident evidence and its integrity and provenance.",
  "annotations": [
    {
      "statement_id": "stmt_norm_002",
      "span": {
        "start_byte": 0,
        "end_byte": 81
      },
      "annotated_text": "Organizations should preserve incident evidence and its integrity and provenance.",
      "epistemic": "POLICY_DECLARATION",
      "deontic": "RECOMMENDED",
      "execution_semantics": "VERIFY",
      "consequential": false
    }
  ]
}
