{
  "schema_version": "runbookbench/v0.1",
  "id": "RB-ADV-003",
  "corpus_class": "ADVERSARIAL_MUTATION",
  "provenance": {
    "publisher": "RunbookBench",
    "title": "Adversarial ambiguous mutation",
    "source_url": "urn:runbookbench:adversarial:003",
    "retrieved_at": "2026-08-27T00:00:00Z",
    "retrieved_sha256": "sha256:d1fb6cdf31cc06a33fdfcd9a9235af2520f12f42c3b3997dd9ebfd7b68f456b6",
    "excerpt_sha256": "sha256:d1fb6cdf31cc06a33fdfcd9a9235af2520f12f42c3b3997dd9ebfd7b68f456b6",
    "license_or_use_note": "Constructed adversarial mutation",
    "redistribution": "CONSTRUCTED",
    "content_mode": "CONSTRUCTED"
  },
  "annotation_state": "ANNOTATION_PENDING",
  "annotation_reviews": [],
  "source_text": "When conditions seem right, delete the records.",
  "annotations": [
    {
      "statement_id": "stmt_adv_003",
      "span": {
        "start_byte": 0,
        "end_byte": 47
      },
      "annotated_text": "When conditions seem right, delete the records.",
      "epistemic": "HYPOTHESIS",
      "deontic": "REQUIRED",
      "execution_semantics": "ACTION",
      "consequential": true,
      "expected_capability": "delete_records@1",
      "ambiguous": true
    }
  ]
}
